{
  "schemaVersion": "0.1.0-draft",
  "generatedAt": "2026-09-09T00:00:00-06:00",
  "status": "research_sample_not_application_ready",
  "records": [
    {
      "id": "move:scratch",
      "entityId": "move:scratch",
      "canonicalSlug": "scratch",
      "canonicalName": "Scratch",
      "facts": {
        "element": { "value": "Normal", "status": "supported", "evidenceIds": ["evidence:pka-chimchar-moves:2026-09-09"] },
        "slot": { "value": "M1", "status": "supported", "evidenceIds": ["evidence:pka-chimchar-moves:2026-09-09"] },
        "cooldown": { "value": { "amount": 12, "unit": "second" }, "status": "supported", "evidenceIds": ["evidence:pka-chimchar-moves:2026-09-09"] },
        "combatMode": { "value": "PVE", "status": "supported", "evidenceIds": ["evidence:pka-chimchar-moves:2026-09-09"] },
        "learnedBy": { "value": ["pokemon:chimchar"], "status": "supported", "evidenceIds": ["evidence:pka-chimchar-moves:2026-09-09"] }
      }
    }
  ]
}
