{
  "schemaVersion": "0.1.0-draft",
  "generatedAt": "2026-09-09T00:00:00-06:00",
  "status": "research_sample_not_application_ready",
  "records": [
    {
      "id": "pokemon:chimchar",
      "canonicalSlug": "chimchar",
      "canonicalName": "Chimchar",
      "pokedexNumber": 390,
      "variant": "normal",
      "facts": {
        "hp": { "value": 470, "status": "supported", "evidenceIds": ["evidence:pka-chimchar:2026-09-09"] },
        "experience": { "value": 1575, "status": "supported", "evidenceIds": ["evidence:pka-chimchar:2026-09-09"] },
        "requiredLevel": { "value": 30, "status": "supported", "evidenceIds": ["evidence:pka-chimchar:2026-09-09"] },
        "tier": { "value": "T6", "status": "supported", "evidenceIds": ["evidence:pka-chimchar:2026-09-09"] },
        "function": { "value": "PVE", "status": "supported", "evidenceIds": ["evidence:pka-chimchar:2026-09-09"] }
      },
      "aliases": [],
      "searchKeywords": { "es": [], "en": [] }
    }
  ]
}
